Je vais à Vienne, il fait très beau et les oiseaux chantent	Vienne	location	10	6			101949
Proche du Rhône, Vienne est une ville bien sympathique	Vienne	location	17	6			101949
Si on traverse le Rhône depuis Vienne, se trouve le musée de Saint-Romain-en-Gall	Vienne	location	31	6			101949
La cathédrale située à Vienne, a été pendant longtemps un siège d’évêché, elle est aujourd’hui rattachée au diocèse de Grenoble	Vienne	location	23	6			101949
Le diocèse qui était centré sur Vienne s’étendait aussi sur une large partie Nord de l’Ardèche, ne l’oublions pas !	Vienne	location	32	6			101949
Vienne est une ville un peu triste, il ne s’y passe pas grand-chose	Vienne	location	0	6			101949
